[I 2026-06-12 00:32:50,995] Trial 79 pruned. 
[I 2026-06-12 00:42:36,470] Trial 80 finished with value: 0.8713898446460223 and parameters: {'threshold': 1.6179581780507948, 'decay': 'none', 'min_potential': -0.08220029033397244, 'discrete': True, 'delay_bounds_min': 4.816366699929819, 'delay_bounds_max': 5.844857220013468, 'decoder': 'vote_decoder', 'lr': 0.0011784673509681745}. Best is trial 80 with value: 0.8713898446460223.
[I 2026-06-12 00:52:22,159] Trial 81 finished with value: 0.8686007715566677 and parameters: {'threshold': 1.5983966942060248, 'decay': 'none', 'min_potential': -0.08148259407683583, 'discrete': True, 'delay_bounds_min': 4.716707260440846, 'delay_bounds_max': 5.744120787752307, 'decoder': 'vote_decoder', 'lr': 0.0011471982238987865}. Best is trial 80 with value: 0.8713898446460223.
[I 2026-06-12 01:02:05,868] Trial 82 finished with value: 0.8692263580439996 and parameters: {'threshold': 1.6099487848954352, 'decay': 'none', 'min_potential': -0.0872381330336391, 'discrete': True, 'delay_bounds_min': 4.7362453316296005, 'delay_bounds_max': 5.6914945100459695, 'decoder': 'vote_decoder', 'lr': 0.0011742364843163238}. Best is trial 80 with value: 0.8713898446460223.
[I 2026-06-12 01:11:51,957] Trial 83 finished with value: 0.8604420811177145 and parameters: {'threshold': 1.594727855168381, 'decay': 'none', 'min_potential': -0.09095222049758152, 'discrete': True, 'delay_bounds_min': 4.417524533795291, 'delay_bounds_max': 5.775674746843869, 'decoder': 'vote_decoder', 'lr': 0.001258567635770818}. Best is trial 80 with value: 0.8713898446460223.
[I 2026-06-12 01:21:36,495] Trial 84 finished with value: 0.8667761443019497 and parameters: {'threshold': 1.8707217979339044, 'decay': 'none', 'min_potential': -0.08507937449599483, 'discrete': True, 'delay_bounds_min': 4.757119248359942, 'delay_bounds_max': 6.274668932483667, 'decoder': 'vote_decoder', 'lr': 0.00048682043685828154}. Best is trial 80 with value: 0.8713898446460223.
[I 2026-06-12 01:31:25,301] Trial 85 finished with value: 0.8702168699822751 and parameters: {'threshold': 1.9004088880106682, 'decay': 'none', 'min_potential': -0.08628918465209703, 'discrete': True, 'delay_bounds_min': 4.99221716913767, 'delay_bounds_max': 5.70926353419061, 'decoder': 'vote_decoder', 'lr': 0.000442943548203575}. Best is trial 80 with value: 0.8713898446460223.
[I 2026-06-12 01:41:14,593] Trial 86 finished with value: 0.8652643102908977 and parameters: {'threshold': 1.683854710333811, 'decay': 'none', 'min_potential': -0.086506303117754, 'discrete': True, 'delay_bounds_min': 5.307827012694269, 'delay_bounds_max': 6.452871691895958, 'decoder': 'vote_decoder', 'lr': 0.0010741666201837968}. Best is trial 80 with value: 0.8713898446460223.
[I 2026-06-12 01:51:00,017] Trial 87 finished with value: 0.862344906683349 and parameters: {'threshold': 1.8042207601411717, 'decay': 'none', 'min_potential': -0.08024947280433457, 'discrete': True, 'delay_bounds_min': 5.0982525892171875, 'delay_bounds_max': 5.6324567800932455, 'decoder': 'vote_decoder', 'lr': 0.0003842005536618658}. Best is trial 80 with value: 0.8713898446460223.
[I 2026-06-12 02:00:46,180] Trial 88 finished with value: 0.8676884579293087 and parameters: {'threshold': 1.5605448553682164, 'decay': 'none', 'min_potential': -0.08848225861552972, 'discrete': True, 'delay_bounds_min': 4.323425311054137, 'delay_bounds_max': 5.56874050366158, 'decoder': 'vote_decoder', 'lr': 0.0009187264345325246}. Best is trial 80 with value: 0.8713898446460223.
[I 2026-06-12 02:10:29,838] Trial 89 finished with value: 0.868861432593056 and parameters: {'threshold': 1.5538616922791568, 'decay': 'none', 'min_potential': -0.09248893985852816, 'discrete': True, 'delay_bounds_min': 4.233412631703217, 'delay_bounds_max': 5.594609680905974, 'decoder': 'vote_decoder', 'lr': 0.0001452535179402429}. Best is trial 80 with value: 0.8713898446460223.
[I 2026-06-12 02:13:45,382] Trial 90 pruned. 
[I 2026-06-12 02:23:31,394] Trial 91 finished with value: 0.8712334480241893 and parameters: {'threshold': 1.5565537639773108, 'decay': 'none', 'min_potential': -0.08885230672805838, 'discrete': True, 'delay_bounds_min': 4.210896936917602, 'delay_bounds_max': 5.58873794440775, 'decoder': 'vote_decoder', 'lr': 0.00015532601698230067}. Best is trial 80 with value: 0.8713898446460223.
[I 2026-06-12 02:33:17,629] Trial 92 finished with value: 0.8669846731310604 and parameters: {'threshold': 1.6224038816985435, 'decay': 'none', 'min_potential': -0.09893077639847636, 'discrete': True, 'delay_bounds_min': 4.765422044152453, 'delay_bounds_max': 5.914378668267706, 'decoder': 'vote_decoder', 'lr': 0.00014768465142493605}. Best is trial 80 with value: 0.8713898446460223.
[I 2026-06-12 02:43:08,650] Trial 93 finished with value: 0.8712073819205505 and parameters: {'threshold': 1.6787405542142078, 'decay': 'none', 'min_potential': -0.08152732522062096, 'discrete': True, 'delay_bounds_min': 3.8128568624751358, 'delay_bounds_max': 4.706118725253194, 'decoder': 'vote_decoder', 'lr': 0.0005750954697009481}. Best is trial 80 with value: 0.8713898446460223.
[I 2026-06-12 02:52:55,396] Trial 94 finished with value: 0.8701386716713586 and parameters: {'threshold': 1.48469668629942, 'decay': 'none', 'min_potential': -0.07709477707687529, 'discrete': True, 'delay_bounds_min': 2.4508204702158443, 'delay_bounds_max': 4.64444028638982, 'decoder': 'vote_decoder', 'lr': 0.00011788665409898712}. Best is trial 80 with value: 0.8713898446460223.
[I 2026-06-12 03:02:45,416] Trial 95 finished with value: 0.8690699614221666 and parameters: {'threshold': 1.5150349147530708, 'decay': 'none', 'min_potential': -0.07750308598790057, 'discrete': True, 'delay_bounds_min': 2.466468134311341, 'delay_bounds_max': 4.482245864532614, 'decoder': 'vote_decoder', 'lr': 0.0006350916097693913}. Best is trial 80 with value: 0.8713898446460223.
[I 2026-06-12 03:12:32,988] Trial 96 finished with value: 0.8724585548952143 and parameters: {'threshold': 1.6762099366288121, 'decay': 'none', 'min_potential': -0.07666551162629098, 'discrete': True, 'delay_bounds_min': 2.307213078838262, 'delay_bounds_max': 3.631013288498166, 'decoder': 'vote_decoder', 'lr': 0.0006418726960772854}. Best is trial 96 with value: 0.8724585548952143.
[I 2026-06-12 03:22:21,391] Trial 97 finished with value: 0.8762642060264831 and parameters: {'threshold': 1.480225712417752, 'decay': 'none', 'min_potential': -0.07617387433603225, 'discrete': True, 'delay_bounds_min': 2.371068657241743, 'delay_bounds_max': 3.869772905406638, 'decoder': 'vote_decoder', 'lr': 0.0004955011120842235}. Best is trial 97 with value: 0.8762642060264831.
[I 2026-06-12 03:32:12,037] Trial 98 finished with value: 0.8728756125534355 and parameters: {'threshold': 1.6923518286257382, 'decay': 'none', 'min_potential': -0.08216456604844409, 'discrete': True, 'delay_bounds_min': 1.7508973573844264, 'delay_bounds_max': 3.6358421557757685, 'decoder': 'vote_decoder', 'lr': 0.0005059338692166438}. Best is trial 97 with value: 0.8762642060264831.
[I 2026-06-12 03:41:59,356] Trial 99 finished with value: 0.8644823271817329 and parameters: {'threshold': 1.677141633979704, 'decay': 'none', 'min_potential': -0.0740645174652229, 'discrete': True, 'delay_bounds_min': 3.1595766644142156, 'delay_bounds_max': 3.7987680663387144, 'decoder': 'vote_decoder', 'lr': 0.0005039747956892577}. Best is trial 97 with value: 0.8762642060264831.
