[I 2026-06-11 13:54:51,621] A new study created in memory with name: no-name-182c9b6c-8f28-4cce-85ee-b2b3816912cf
/lustre/isaac24/scratch/jhanna8/repos/tennlab-slayer/src/tennlab_slayer/train_test.py:314: FutureWarning: `torch.distributed.reduce_op` is deprecated, please use `torch.distributed.ReduceOp` instead
  if isinstance(obj, _MultiProcessingDataLoaderIter):
[I 2026-06-11 14:07:34,530] Trial 0 finished with value: 0.5 and parameters: {'threshold': 1.0481225600790258, 'decay': 'none', 'min_potential': -0.02690801366244118, 'discrete': False, 'delay_bounds_min': 11.817339162743934, 'delay_bounds_max': 15.605185795777942, 'decoder': 'vote_decoder', 'lr': 0.0019344288579328632}. Best is trial 0 with value: 0.5.
[I 2026-06-11 14:17:22,776] Trial 1 finished with value: 0.5 and parameters: {'threshold': 1.547067368734532, 'decay': 'none', 'min_potential': -0.05014055319047908, 'discrete': True, 'delay_bounds_min': 9.606220364715602, 'delay_bounds_max': 10.05800704180192, 'decoder': 'vote_decoder', 'lr': 0.007160411636616173}. Best is trial 0 with value: 0.5.
[I 2026-06-11 14:27:13,412] Trial 2 finished with value: 0.5 and parameters: {'threshold': 0.4100626162934383, 'decay': 'none', 'min_potential': -0.08418023481481868, 'discrete': False, 'delay_bounds_min': 8.454954506214847, 'delay_bounds_max': 16.990864631134148, 'decoder': 'vote_decoder', 'lr': 0.00972489712142975}. Best is trial 0 with value: 0.5.
[I 2026-06-11 14:37:00,967] Trial 3 finished with value: 0.5 and parameters: {'threshold': 0.7475253178060997, 'decay': 'all', 'min_potential': -0.05749191813219991, 'discrete': True, 'delay_bounds_min': 18.463940276248326, 'delay_bounds_max': 19.233201645807494, 'decoder': 'vote_decoder', 'lr': 0.0042041377963674235}. Best is trial 0 with value: 0.5.
[I 2026-06-11 14:46:50,602] Trial 4 finished with value: 0.5 and parameters: {'threshold': 1.3461402901548931, 'decay': 'none', 'min_potential': -0.026139961976815146, 'discrete': True, 'delay_bounds_min': 15.610146357609832, 'delay_bounds_max': 19.67800301691788, 'decoder': 'vote_decoder', 'lr': 0.002998883056535379}. Best is trial 0 with value: 0.5.
[I 2026-06-11 14:56:40,329] Trial 5 finished with value: 0.5 and parameters: {'threshold': 1.8567039069874616, 'decay': 'all', 'min_potential': -0.0672266858591839, 'discrete': False, 'delay_bounds_min': 11.675307664235092, 'delay_bounds_max': 18.44015223303975, 'decoder': 'vote_decoder', 'lr': 0.004328497382192731}. Best is trial 0 with value: 0.5.
[I 2026-06-11 15:06:38,995] Trial 6 finished with value: 0.5 and parameters: {'threshold': 0.7007810189194001, 'decay': 'all', 'min_potential': -0.09187219988831846, 'discrete': False, 'delay_bounds_min': 15.991265855175243, 'delay_bounds_max': 17.848566431895698, 'decoder': 'vote_decoder', 'lr': 0.00511417959804102}. Best is trial 0 with value: 0.5.
[I 2026-06-11 15:16:36,376] Trial 7 finished with value: 0.5 and parameters: {'threshold': 0.19533381147892503, 'decay': 'none', 'min_potential': -0.023074922289400293, 'discrete': True, 'delay_bounds_min': 8.360738289375853, 'delay_bounds_max': 14.145313013201383, 'decoder': 'vote_decoder', 'lr': 0.008919459874826584}. Best is trial 0 with value: 0.5.
[I 2026-06-11 15:26:36,575] Trial 8 finished with value: 0.8383119591283495 and parameters: {'threshold': 1.0781133695032195, 'decay': 'none', 'min_potential': -0.07001094863788389, 'discrete': True, 'delay_bounds_min': 2.4679684379312943, 'delay_bounds_max': 14.085615411418198, 'decoder': 'vote_decoder', 'lr': 0.009885714015714128}. Best is trial 8 with value: 0.8383119591283495.
[I 2026-06-11 15:36:36,155] Trial 9 finished with value: 0.5 and parameters: {'threshold': 0.2196803503424418, 'decay': 'none', 'min_potential': -0.008088237209060573, 'discrete': True, 'delay_bounds_min': 12.463316822694658, 'delay_bounds_max': 19.599194476252478, 'decoder': 'vote_decoder', 'lr': 0.0006691478275756783}. Best is trial 8 with value: 0.8383119591283495.
[I 2026-06-11 15:46:32,948] Trial 10 finished with value: 0.8473047648837452 and parameters: {'threshold': 1.9820860825095707, 'decay': 'all', 'min_potential': -0.0006256297389182208, 'discrete': True, 'delay_bounds_min': 1.1316163409935704, 'delay_bounds_max': 5.620009730386081, 'decoder': 'vote_decoder', 'lr': 0.006380844954409432}. Best is trial 10 with value: 0.8473047648837452.
[I 2026-06-11 15:56:24,819] Trial 11 finished with value: 0.5 and parameters: {'threshold': 1.9824466345563323, 'decay': 'all', 'min_potential': -5.1987772360290174e-05, 'discrete': True, 'delay_bounds_min': 1.6824983364559107, 'delay_bounds_max': 1.9778227916554378, 'decoder': 'vote_decoder', 'lr': 0.007151220533763876}. Best is trial 10 with value: 0.8473047648837452.
[I 2026-06-11 16:06:16,034] Trial 12 finished with value: 0.847487227609217 and parameters: {'threshold': 1.5175911400689754, 'decay': 'all', 'min_potential': -0.04305638912094405, 'discrete': True, 'delay_bounds_min': 1.0574042945856643, 'delay_bounds_max': 5.920802487243658, 'decoder': 'vote_decoder', 'lr': 0.00783271721833067}. Best is trial 12 with value: 0.847487227609217.
[I 2026-06-11 16:16:07,907] Trial 13 finished with value: 0.760765300802836 and parameters: {'threshold': 1.6554779150824133, 'decay': 'all', 'min_potential': -0.040053061001176886, 'discrete': True, 'delay_bounds_min': 4.579942619524838, 'delay_bounds_max': 5.362321141689202, 'decoder': 'vote_decoder', 'lr': 0.007288654224959232}. Best is trial 12 with value: 0.847487227609217.
[I 2026-06-11 16:26:00,030] Trial 14 finished with value: 0.8559065790845585 and parameters: {'threshold': 1.64067064010389, 'decay': 'all', 'min_potential': -0.011856887210666828, 'discrete': True, 'delay_bounds_min': 4.691998980717502, 'delay_bounds_max': 8.097007593406552, 'decoder': 'vote_decoder', 'lr': 0.00602717523790248}. Best is trial 14 with value: 0.8559065790845585.
[I 2026-06-11 16:35:49,725] Trial 15 finished with value: 0.8519966635387343 and parameters: {'threshold': 1.3554082209891858, 'decay': 'all', 'min_potential': -0.03939474321011035, 'discrete': True, 'delay_bounds_min': 5.68179123199968, 'delay_bounds_max': 9.491765532892705, 'decoder': 'vote_decoder', 'lr': 0.005555487013255622}. Best is trial 14 with value: 0.8559065790845585.
[I 2026-06-11 16:45:41,849] Trial 16 finished with value: 0.8536127619643415 and parameters: {'threshold': 1.2538071546766751, 'decay': 'all', 'min_potential': -0.015840394930669008, 'discrete': True, 'delay_bounds_min': 5.490411671520453, 'delay_bounds_max': 10.479338298137368, 'decoder': 'vote_decoder', 'lr': 0.005560603990417761}. Best is trial 14 with value: 0.8559065790845585.
[I 2026-06-11 16:55:38,740] Trial 17 finished with value: 0.8530393076842874 and parameters: {'threshold': 1.050618996736504, 'decay': 'all', 'min_potential': -0.014481544138357418, 'discrete': True, 'delay_bounds_min': 5.201218659173946, 'delay_bounds_max': 10.907732782179908, 'decoder': 'vote_decoder', 'lr': 0.0032294650235493434}. Best is trial 14 with value: 0.8559065790845585.
[I 2026-06-11 17:05:35,550] Trial 18 finished with value: 0.5 and parameters: {'threshold': 1.7369965107509686, 'decay': 'all', 'min_potential': -0.014900810045915112, 'discrete': False, 'delay_bounds_min': 6.678167670619481, 'delay_bounds_max': 11.803308302535326, 'decoder': 'vote_decoder', 'lr': 0.0054715829577008475}. Best is trial 14 with value: 0.8559065790845585.
[I 2026-06-11 17:15:27,979] Trial 19 finished with value: 0.8470962360546346 and parameters: {'threshold': 1.2843208976975273, 'decay': 'all', 'min_potential': -0.02942821579138611, 'discrete': True, 'delay_bounds_min': 3.5365804777970116, 'delay_bounds_max': 7.966811675098913, 'decoder': 'vote_decoder', 'lr': 0.008302675087545562}. Best is trial 14 with value: 0.8559065790845585.
[I 2026-06-11 17:25:20,955] Trial 20 finished with value: 0.5 and parameters: {'threshold': 0.7601626378345148, 'decay': 'all', 'min_potential': -0.011847375277394764, 'discrete': True, 'delay_bounds_min': 7.062779658809716, 'delay_bounds_max': 12.470412275416974, 'decoder': 'vote_decoder', 'lr': 0.006288128606919246}. Best is trial 14 with value: 0.8559065790845585.
[I 2026-06-11 17:35:11,183] Trial 21 finished with value: 0.8586435199666353 and parameters: {'threshold': 1.0617490164648178, 'decay': 'all', 'min_potential': -0.0177289002863135, 'discrete': True, 'delay_bounds_min': 4.299047794253207, 'delay_bounds_max': 10.150490633700946, 'decoder': 'vote_decoder', 'lr': 0.003346438766631519}. Best is trial 21 with value: 0.8586435199666353.
[I 2026-06-11 17:45:00,771] Trial 22 finished with value: 0.8593733708685226 and parameters: {'threshold': 1.2137617229991937, 'decay': 'all', 'min_potential': -0.01919192739441109, 'discrete': True, 'delay_bounds_min': 3.5893978940738362, 'delay_bounds_max': 7.105200667369363, 'decoder': 'vote_decoder', 'lr': 0.0036625597301677597}. Best is trial 22 with value: 0.8593733708685226.
[I 2026-06-11 17:54:55,414] Trial 23 finished with value: 0.8630747575852361 and parameters: {'threshold': 0.9822169076758775, 'decay': 'all', 'min_potential': -0.03585195692635319, 'discrete': True, 'delay_bounds_min': 3.4491240753316337, 'delay_bounds_max': 7.8183308742499475, 'decoder': 'vote_decoder', 'lr': 0.0023389899863604877}. Best is trial 23 with value: 0.8630747575852361.
[I 2026-06-11 18:04:45,978] Trial 24 finished with value: 0.8648211865290376 and parameters: {'threshold': 0.9292230117852733, 'decay': 'all', 'min_potential': -0.03436862320496155, 'discrete': True, 'delay_bounds_min': 3.1229201686364942, 'delay_bounds_max': 8.117735462206465, 'decoder': 'vote_decoder', 'lr': 0.0018873012265936697}. Best is trial 24 with value: 0.8648211865290376.
[I 2026-06-11 18:14:37,291] Trial 25 finished with value: 0.8572098842664998 and parameters: {'threshold': 0.8813840249880299, 'decay': 'all', 'min_potential': -0.032547603619710284, 'discrete': True, 'delay_bounds_min': 3.0137947203368065, 'delay_bounds_max': 7.599228712303176, 'decoder': 'vote_decoder', 'lr': 0.001349575746074392}. Best is trial 24 with value: 0.8648211865290376.
[I 2026-06-11 18:24:38,193] Trial 26 finished with value: 0.8607809404650193 and parameters: {'threshold': 0.5563493766898009, 'decay': 'all', 'min_potential': -0.05135479813536106, 'discrete': False, 'delay_bounds_min': 3.30333207085728, 'delay_bounds_max': 4.245646461770123, 'decoder': 'vote_decoder', 'lr': 0.0016573034874582246}. Best is trial 24 with value: 0.8648211865290376.
[I 2026-06-11 18:34:36,150] Trial 27 finished with value: 0.8605984777395475 and parameters: {'threshold': 0.5096921490586352, 'decay': 'all', 'min_potential': -0.052769659044762156, 'discrete': False, 'delay_bounds_min': 2.787729394539816, 'delay_bounds_max': 3.3979941398631746, 'decoder': 'vote_decoder', 'lr': 0.002183903375779822}. Best is trial 24 with value: 0.8648211865290376.
[I 2026-06-11 18:37:56,572] Trial 28 pruned. 
[I 2026-06-11 18:47:59,367] Trial 29 finished with value: 0.8547857366280889 and parameters: {'threshold': 0.9142037588085075, 'decay': 'all', 'min_potential': -0.033770556180134186, 'discrete': False, 'delay_bounds_min': 2.530141399096852, 'delay_bounds_max': 4.085702187899531, 'decoder': 'vote_decoder', 'lr': 0.0021034680747825563}. Best is trial 24 with value: 0.8648211865290376.
[I 2026-06-11 18:51:19,184] Trial 30 pruned. 
[I 2026-06-11 19:01:21,937] Trial 31 pruned. 
[I 2026-06-11 19:11:23,013] Trial 32 finished with value: 0.8590084454175789 and parameters: {'threshold': 0.34849083918724566, 'decay': 'all', 'min_potential': -0.0521937378489002, 'discrete': False, 'delay_bounds_min': 3.801331251118336, 'delay_bounds_max': 6.71568426749498, 'decoder': 'vote_decoder', 'lr': 0.0026050774319624076}. Best is trial 24 with value: 0.8648211865290376.
[I 2026-06-11 19:21:26,972] Trial 33 finished with value: 0.8633875508289021 and parameters: {'threshold': 0.5252184232176899, 'decay': 'all', 'min_potential': -0.06163208263975875, 'discrete': False, 'delay_bounds_min': 5.917889337420589, 'delay_bounds_max': 8.82312120389063, 'decoder': 'vote_decoder', 'lr': 0.001618008706077679}. Best is trial 24 with value: 0.8648211865290376.
[I 2026-06-11 19:24:50,662] Trial 34 pruned. 
[I 2026-06-11 19:28:13,855] Trial 35 pruned. 
[I 2026-06-11 19:31:36,512] Trial 36 pruned. 
[I 2026-06-11 19:34:56,997] Trial 37 pruned. 
[I 2026-06-11 19:44:47,227] Trial 38 finished with value: 0.853247836513398 and parameters: {'threshold': 0.2841879372294186, 'decay': 'all', 'min_potential': -0.07965432222946178, 'discrete': False, 'delay_bounds_min': 4.4706384860005, 'delay_bounds_max': 8.384112262171035, 'decoder': 'vote_decoder', 'lr': 0.004057410428106995}. Best is trial 24 with value: 0.8648211865290376.
[I 2026-06-11 19:48:03,851] Trial 39 pruned. 
[I 2026-06-11 19:51:20,458] Trial 40 pruned. 
[I 2026-06-11 20:01:10,957] Trial 41 finished with value: 0.8584871233448024 and parameters: {'threshold': 0.4780362488058212, 'decay': 'all', 'min_potential': -0.05247526404911221, 'discrete': False, 'delay_bounds_min': 2.03899921233259, 'delay_bounds_max': 4.22982838885134, 'decoder': 'vote_decoder', 'lr': 0.002046489088511849}. Best is trial 24 with value: 0.8648211865290376.
[I 2026-06-11 20:11:02,425] Trial 42 finished with value: 0.8574184130956105 and parameters: {'threshold': 0.7777316994039261, 'decay': 'all', 'min_potential': -0.09690728294046581, 'discrete': False, 'delay_bounds_min': 3.3465444553585963, 'delay_bounds_max': 6.601794989417485, 'decoder': 'vote_decoder', 'lr': 0.0028854134812297235}. Best is trial 24 with value: 0.8648211865290376.
[I 2026-06-11 20:20:55,272] Trial 43 finished with value: 0.8428213950578668 and parameters: {'threshold': 0.9737112116442965, 'decay': 'all', 'min_potential': -0.04858660973408385, 'discrete': False, 'delay_bounds_min': 2.806115580344725, 'delay_bounds_max': 4.285222516223666, 'decoder': 'vote_decoder', 'lr': 0.0020611455130827632}. Best is trial 24 with value: 0.8648211865290376.
[I 2026-06-11 20:27:31,034] Trial 44 pruned. 
[I 2026-06-11 20:37:22,373] Trial 45 finished with value: 0.8515274736732353 and parameters: {'threshold': 0.48907673711565913, 'decay': 'all', 'min_potential': -0.05519846143172824, 'discrete': False, 'delay_bounds_min': 5.09071697987835, 'delay_bounds_max': 6.1236575514687335, 'decoder': 'vote_decoder', 'lr': 0.004569188694388543}. Best is trial 24 with value: 0.8648211865290376.
[I 2026-06-11 20:47:11,201] Trial 46 pruned. 
[I 2026-06-11 20:50:27,969] Trial 47 pruned. 
[I 2026-06-11 21:00:18,343] Trial 48 finished with value: 0.6122145761651548 and parameters: {'threshold': 0.2925090038291416, 'decay': 'all', 'min_potential': -0.03793876007632715, 'discrete': True, 'delay_bounds_min': 1.9263119511962774, 'delay_bounds_max': 2.9185083384860553, 'decoder': 'vote_decoder', 'lr': 0.002377303180648599}. Best is trial 24 with value: 0.8648211865290376.
[I 2026-06-11 21:10:08,026] Trial 49 finished with value: 0.8595558335939943 and parameters: {'threshold': 1.1503064062495485, 'decay': 'all', 'min_potential': -0.043408531307694426, 'discrete': True, 'delay_bounds_min': 1.037885635926846, 'delay_bounds_max': 15.062362758560052, 'decoder': 'vote_decoder', 'lr': 0.003010285691794258}. Best is trial 24 with value: 0.8648211865290376.
[I 2026-06-11 21:13:24,425] Trial 50 pruned. 
[I 2026-06-11 21:16:40,992] Trial 51 pruned. 
[I 2026-06-11 21:26:32,255] Trial 52 finished with value: 0.8618235846105724 and parameters: {'threshold': 0.9917216862944592, 'decay': 'all', 'min_potential': -0.05122541916520788, 'discrete': True, 'delay_bounds_min': 2.8450329919987842, 'delay_bounds_max': 16.46224731046942, 'decoder': 'vote_decoder', 'lr': 0.0023694478277199427}. Best is trial 24 with value: 0.8648211865290376.
[I 2026-06-11 21:36:25,797] Trial 53 finished with value: 0.8589563132103013 and parameters: {'threshold': 0.9954411243614102, 'decay': 'all', 'min_potential': -0.06081931800817144, 'discrete': True, 'delay_bounds_min': 2.969856704486407, 'delay_bounds_max': 16.673971775656053, 'decoder': 'vote_decoder', 'lr': 0.001737270844440272}. Best is trial 24 with value: 0.8648211865290376.
[I 2026-06-11 21:39:43,796] Trial 54 pruned. 
[I 2026-06-11 21:49:36,733] Trial 55 finished with value: 0.8483474090292983 and parameters: {'threshold': 0.9967558150502784, 'decay': 'all', 'min_potential': -0.07197792289502693, 'discrete': True, 'delay_bounds_min': 5.265536787813871, 'delay_bounds_max': 6.541219837924179, 'decoder': 'vote_decoder', 'lr': 0.002385978695601922}. Best is trial 24 with value: 0.8648211865290376.
[I 2026-06-11 21:59:25,184] Trial 56 finished with value: 0.8625273694088208 and parameters: {'threshold': 0.8057920074372182, 'decay': 'all', 'min_potential': -0.021847737544463158, 'discrete': True, 'delay_bounds_min': 3.8563563305162116, 'delay_bounds_max': 4.933691731210688, 'decoder': 'vote_decoder', 'lr': 0.0019325740872257688}. Best is trial 24 with value: 0.8648211865290376.
[I 2026-06-11 22:09:15,053] Trial 57 finished with value: 0.8629183609634032 and parameters: {'threshold': 0.8031349459162356, 'decay': 'all', 'min_potential': -0.02461153578966134, 'discrete': True, 'delay_bounds_min': 4.127033215674117, 'delay_bounds_max': 5.22190672819593, 'decoder': 'vote_decoder', 'lr': 0.0011471208145289046}. Best is trial 24 with value: 0.8648211865290376.
[I 2026-06-11 22:12:31,046] Trial 58 pruned. 
[I 2026-06-11 22:15:46,635] Trial 59 pruned. 
[I 2026-06-11 22:25:33,029] Trial 60 finished with value: 0.8606766760504639 and parameters: {'threshold': 0.9571765200284136, 'decay': 'all', 'min_potential': -0.022649827016278178, 'discrete': True, 'delay_bounds_min': 4.141046447110337, 'delay_bounds_max': 5.241647776093814, 'decoder': 'vote_decoder', 'lr': 0.00270527905150544}. Best is trial 24 with value: 0.8648211865290376.
[I 2026-06-11 22:28:49,049] Trial 61 pruned. 
[I 2026-06-11 22:38:39,247] Trial 62 finished with value: 0.8360963403190491 and parameters: {'threshold': 0.9179619180070696, 'decay': 'all', 'min_potential': -0.03484073245889016, 'discrete': True, 'delay_bounds_min': 3.4661378254192305, 'delay_bounds_max': 4.816781198470543, 'decoder': 'vote_decoder', 'lr': 0.0018310742861239303}. Best is trial 24 with value: 0.8648211865290376.
[I 2026-06-11 22:48:28,733] Trial 63 finished with value: 0.8689656970076113 and parameters: {'threshold': 1.0719344200556136, 'decay': 'all', 'min_potential': -0.029042899039056057, 'discrete': True, 'delay_bounds_min': 5.7222920630193865, 'delay_bounds_max': 6.8236058389732195, 'decoder': 'vote_decoder', 'lr': 0.000965206045649905}. Best is trial 63 with value: 0.8689656970076113.
[I 2026-06-11 22:58:17,523] Trial 64 finished with value: 0.8640652695235116 and parameters: {'threshold': 1.3209367514380665, 'decay': 'all', 'min_potential': -0.030006061133857096, 'discrete': True, 'delay_bounds_min': 5.820703596222934, 'delay_bounds_max': 6.977555023096986, 'decoder': 'vote_decoder', 'lr': 0.0007229017365008868}. Best is trial 63 with value: 0.8689656970076113.
[I 2026-06-11 23:08:05,271] Trial 65 finished with value: 0.8704514649150245 and parameters: {'threshold': 1.340435294447191, 'decay': 'all', 'min_potential': -0.02712025245948135, 'discrete': True, 'delay_bounds_min': 5.699311558926492, 'delay_bounds_max': 7.141973538229938, 'decoder': 'vote_decoder', 'lr': 0.0008743533203335197}. Best is trial 65 with value: 0.8704514649150245.
[I 2026-06-11 23:11:20,469] Trial 66 pruned. 
[I 2026-06-11 23:21:10,217] Trial 67 finished with value: 0.8499374413512668 and parameters: {'threshold': 1.2822006369366516, 'decay': 'all', 'min_potential': -0.030166752315699857, 'discrete': True, 'delay_bounds_min': 5.748767585037637, 'delay_bounds_max': 6.97515240283257, 'decoder': 'vote_decoder', 'lr': 0.000676050826214342}. Best is trial 65 with value: 0.8704514649150245.
[I 2026-06-11 23:24:26,315] Trial 68 pruned. 
[I 2026-06-11 23:27:41,607] Trial 69 pruned. 
[I 2026-06-11 23:37:28,540] Trial 70 finished with value: 0.8688353664894172 and parameters: {'threshold': 1.1845533424995134, 'decay': 'none', 'min_potential': -0.04036037511950228, 'discrete': True, 'delay_bounds_min': 4.926106573002073, 'delay_bounds_max': 7.140146065625067, 'decoder': 'vote_decoder', 'lr': 0.0013689812932360412}. Best is trial 65 with value: 0.8704514649150245.
[I 2026-06-11 23:47:16,566] Trial 71 finished with value: 0.8668282765092274 and parameters: {'threshold': 1.226555223818557, 'decay': 'none', 'min_potential': -0.04005330955756174, 'discrete': True, 'delay_bounds_min': 5.6005118520383625, 'delay_bounds_max': 7.135644855936217, 'decoder': 'vote_decoder', 'lr': 0.0013910409457343687}. Best is trial 65 with value: 0.8704514649150245.
[I 2026-06-11 23:50:31,999] Trial 72 pruned. 
[I 2026-06-11 23:53:47,247] Trial 73 pruned. 
[I 2026-06-12 00:03:32,696] Trial 74 finished with value: 0.8575226775101658 and parameters: {'threshold': 1.3268857741088822, 'decay': 'none', 'min_potential': -0.0362547306544164, 'discrete': True, 'delay_bounds_min': 5.540321924762445, 'delay_bounds_max': 6.259726653887874, 'decoder': 'vote_decoder', 'lr': 0.001405576377518598}. Best is trial 65 with value: 0.8704514649150245.
[I 2026-06-12 00:06:47,294] Trial 75 pruned. 
[I 2026-06-12 00:10:01,572] Trial 76 pruned. 
[I 2026-06-12 00:19:44,332] Trial 77 finished with value: 0.8599207590449379 and parameters: {'threshold': 1.309388628589772, 'decay': 'none', 'min_potential': -0.03506242609912592, 'discrete': True, 'delay_bounds_min': 5.736680880989519, 'delay_bounds_max': 7.141790738717907, 'decoder': 'vote_decoder', 'lr': 0.0014429941829628102}. Best is trial 65 with value: 0.8704514649150245.
[I 2026-06-12 00:29:36,240] Trial 78 finished with value: 0.8692784902512772 and parameters: {'threshold': 1.5686916279271275, 'decay': 'none', 'min_potential': -0.0898616045886429, 'discrete': True, 'delay_bounds_min': 4.761765034648649, 'delay_bounds_max': 5.727279050000959, 'decoder': 'vote_decoder', 'lr': 0.0010216122407165364}. Best is trial 65 with value: 0.8704514649150245.
